{
 "name": "sheala-aio-020",
 "author": "jlrouzies-fr",
 "version": "1.0.0",
 "status": "ready",
 "character": "sheala",
 "slot": "c_07_ma__emhyr_hair",
 "base_build": "sheala",
 "tags": [
  "female",
  "long",
  "black",
  "all-in-one"
 ],
 "studio_version": "0.2.1",
 "description": "Sheala as in the All In One 0.2.0 build (baked geometry + look), applies on any base of the character. Needs Studio 0.2.1 or newer.",
 "mesh_fingerprint": {
  "guides": 375,
  "faces": 705
 }
}