{
 "name": "emhyr-aio-020",
 "author": "jlrouzies-fr",
 "version": "1.0.0",
 "status": "ready",
 "character": "emhyr",
 "slot": "c_07_ma__emhyr_hair",
 "base_build": "emhyr",
 "tags": [
  "male",
  "short",
  "black",
  "all-in-one"
 ],
 "studio_version": "0.2.1",
 "description": "Emhyr as in the All In One 0.2.0 build (baked geometry + look), applies on any base of the character. Needs Studio 0.2.1 or newer.",
 "mesh_fingerprint": {
  "guides": 556,
  "faces": 950
 }
}