{
 "name": "ciri-aio-020",
 "author": "jlrouzies-fr",
 "version": "1.0.0",
 "status": "ready",
 "character": "ciri",
 "slot": "ciri_hair",
 "base_build": "ciri",
 "tags": [
  "female",
  "long",
  "white",
  "all-in-one"
 ],
 "studio_version": "0.2.1",
 "description": "Ciri as in the All In One 0.2.0 build (baked geometry + look), applies on any base of the character. Needs Studio 0.2.1 or newer.",
 "mesh_fingerprint": {
  "guides": 201,
  "faces": 313
 }
}