{
 "name": "udalryk-mcp4",
 "author": "jlrouzies-fr",
 "version": "1.0.0",
 "status": "wip",
 "character": "udalryk",
 "slot": "c_01_ma__udalryk",
 "base_build": "udalryk_l340_hairbeard",
 "tags": [
  "male",
  "wip"
 ],
 "studio_version": "0.2.1",
 "description": "Udalryk: Studio pass mcp_4 (nape guides to the collar, sides swept back, ears clear). Work in progress, not checked in game. Baked geometry + look, applies on any base of the character; needs Studio 0.2.1 or newer.",
 "mesh_fingerprint": {
  "guides": 684,
  "faces": 1201
 }
}